{
  "version": 2.0,
  "success": true,
  "reason": null,
  "content": {
    "status": "success",
    "message": "Create a new tag \"dmlong-create-a-new-tag-name\" succeeded."
  },
  "raw": null,
  "inputs": {
    "palo_alto_firewall_tag_name": "dmlong-create-a-new-tag-name"
  },
  "metrics": {
    "version": "1.0",
    "package": "fn-pa-firewall",
    "package_version": "1.0.0",
    "host": "DMLONG-LAP",
    "execution_time_ms": 1321,
    "timestamp": "2023-03-09 10:10:25"
  }
}