{
  "version": 2.0,
  "success": true,
  "reason": null,
  "content": {
    "status": "success",
    "message": "Delete IP address object \"blacklist-45.150.64.88\" succeeded."
  },
  "raw": null,
  "inputs": {
    "palo_alto_firewall_address_objects_name": "blacklist-45.150.64.88"
  },
  "metrics": {
    "version": "1.0",
    "package": "fn-pa-firewall",
    "package_version": "1.0.0",
    "host": "DMLONG-LAP",
    "execution_time_ms": 818,
    "timestamp": "2023-03-09 10:16:04"
  }
}